<?xml version="1.0" encoding="UTF-8"?>
<whatsapp_data xmlns="http://whatsapp.clone/data" xmlns:xsi="http://www.w3.org/2001/XMLSchema-instance" xsi:schemaLocation="http://whatsapp.clone/data ../schemas/whatsapp_data.xsd">
    
    <users>
        <user id="user1">
            <name>John Doe</name>
            <email>john@example.com</email>
            <status>active</status>
            <settings>
                <setting key="notifications" value="enabled"/>
                <setting key="theme" value="dark"/>
            </settings>
        </user>
        <user id="user2">
            <name>Jane Smith</name>
            <email>jane@example.com</email>
            <status>active</status>
            <settings/>
        </user>
    <user id="user3"><name>Test User</name><email>test@example.com</email><status>active</status><settings/></user></users>

    <contacts>
        <contact id="contact1">
            <name>John Doe</name>
            <user_id>user1</user_id>
        </contact>
    </contacts>

    <groups>
        <group id="group1">
            <name>Famille</name>
            <description>Groupe familial</description>
            <members>
                <member user_id="user1" role="admin"/>
                <member user_id="user2" role="member"/>
            </members>
        </group>
    </groups>

    <messages>
        <message id="msg1">
            <content>Bonjour tout le monde!</content>
            <type>text</type>
            <timestamp>2024-12-19 10:30:00</timestamp>
            <status>sent</status>
            <from_user>user1</from_user>
            <to_group>group1</to_group>
        </message>
        <message id="msg2">
            <content>Salut!</content>
            <type>text</type>
            <timestamp>2024-12-19 10:35:00</timestamp>
            <status>received</status>
            <from_user>user2</from_user>
            <to_user>user1</to_user>
        </message>
    </messages>

</whatsapp_data>
